Option,Description,Examples with default value
--filter-eqtl-p,Filter eQTLs with p-value > the cutoff ,--filter-eqtl-p 1E-2
--filter-maf-le,Filer variants with MAF ≤ the cutoff,--filter-maf-le 0.02
--hwe-all,Filter variants with HWD test p-value < the cutoff,--filter-eqtl-p 1E-5
--ld-pruning-mr,Prune a variant with genotypic correlation to another variant> the cutoff for causal gene estimation by MR,--ld-pruning-mr 0.5
--multiple-testing [bonf/benfdr/ fixed],The multiple testing method used to select significant genes for the conditional gene-based analysis. There are three settings. bonf: Standard Bonferroni correction given a family-wise error rate specified by --p-value-cutoff.  benfdr: Benjamini-Hochberg method to control the false discovery rate. fixed: Filtering by a fixed p-value cutoff.,--multiple-testing bonf
--p-value-cutoff,The family-wise cutoff for the multiple testing.,--p-value-cutoff 0.05
--only-hgnc-gene,only consider genes with HGNC gene symbols,
--neargene,Set the extension window size of a gene cover more potential regulatory variants.,--neargene 5000
--regions-out,Exclude variants in the specified regions,
